{
  "schema": "rafaelia.seed_omega_evolution.v1",
  "seed_id": "SEED-OMEGA-EVOLUTION-V1-GENESIS",
  "generated_at": "2026-09-15T20:30:00-03:00",
  "state": "CANONICAL_DRAFT",
  "claim_allowed": false,
  "generation": 0,
  "parents": [],
  "genotype": {
    "discrete_memory": "typed operators + lineage + constraints",
    "analogy": "DNA-like inheritance is pedagogical only",
    "boundary": "GENOTYPE_COMPUTATIONAL_NOT_BIOLOGICAL_DNA"
  },
  "phenotype": {
    "dynamic_state": "environment-conditioned realized model",
    "analogy": "water-like plasticity is pedagogical only",
    "boundary": "PLASTICITY_ANALOGY_NOT_FLUID_IDENTITY"
  },
  "operator_set": [
    "DIRECT",
    "INDIRECT",
    "DERIVATIVE",
    "INVERSE",
    "REVERSE",
    "ANTIDERIVATIVE",
    "RECLUSIVE_CLOSURE",
    "LOG",
    "ITERATED_LOG",
    "TANGENTIAL",
    "ORTHOGONAL",
    "TRANSVERSAL",
    "LATERAL",
    "RECURSIVE",
    "RECOMBINE",
    "PERMUTE",
    "BACKCROSS",
    "QUIESCE",
    "REACTIVATE",
    "LATENT_RELATION_PROBE",
    "NOISE_RECLASSIFY",
    "GEODESIC_STEP"
  ],
  "scale_contract": {
    "q": "sqrt(3)/2",
    "formula": "a_n=a_0*(sqrt(3)/2)^n",
    "boundary": "EUCLIDEAN_SCALE_NOT_AUTOMATIC_HYPERBOLIC_GEODESIC"
  },
  "environment": {
    "mode": "IN_VITRO_QUIESCENT_KNOWLEDGE_BANK",
    "isolated_lineages": true,
    "cross_recombination": "EXPLICIT_ONLY",
    "mutation_policy": "BOUNDED_AND_LOGGED",
    "tube_semantics": "Each tube stores a low-activity lineage/state available for later combination, probe, backcross or reactivation."
  },
  "lineage": {
    "append_only": true,
    "preserve_ancestors": true,
    "supersedes": null,
    "topology": "TEMPORAL_DAG_WITH_MULTIPARENT_HYPEREDGES",
    "backcross_allowed": true
  },
  "evaluation": {
    "dimensions": [
      "coherence",
      "novelty",
      "reconstruction",
      "evidence",
      "robustness",
      "cost"
    ],
    "selection_rule": "PARETO_FRONT"
  },
  "provenance": [
    {
      "repo": "rafaelmeloreisnovo/Mapa",
      "path": "data/formulas/SESSION_FORMULA_REGISTRY_53_V1.json",
      "ref": "main",
      "binding": "F01,F43,F45,F47,F51,F53"
    },
    {
      "repo": "rafaelmeloreisnovo/papers",
      "path": "research_notes/2026-08-31_ATLAS_X_SQRT3_PI_PHI_F4.md",
      "ref": "main",
      "binding": "sqrt3/2 scale and Poincare gate"
    }
  ],
  "gaps": [
    "operator domains/codomains not fully formalized",
    "mutation distributions TOKEN_VAZIO",
    "recombination compatibility matrix TOKEN_VAZIO",
    "backcross trait masks benchmark TOKEN_VAZIO",
    "noise residual classifier benchmark TOKEN_VAZIO",
    "finite simulator TOKEN_VAZIO",
    "benchmark and independent reproduction TOKEN_VAZIO"
  ],
  "r3": {
    "F_ok": "seed schema refined to non-linear temporal hypergraph with quiescent bank, latent relations, backcross and symmetric practice-theory residual",
    "F_gap": "runtime simulator, operator algebra closure, trait-mask benchmark and noise reclassification remain TOKEN_VAZIO",
    "F_next": "implement finite deterministic hypergraph producer in RafPolimata with quiescence/reactivation/backcross receipts and replay"
  },
  "knowledge_graph": {
    "topology": "TEMPORAL_TYPED_HYPERGRAPH",
    "relation_types": [
      "CONNECTION",
      "INTEGRATION",
      "RELATION",
      "INTERCONNECTION",
      "ANOMALY",
      "PARADOX",
      "FORMULATION",
      "DERIVABLE_LATENT",
      "CONTRADICTION",
      "EVIDENCE",
      "HEURISTIC"
    ],
    "projection_rule": "HIDDEN_IN_VIEW_DOES_NOT_IMPLY_ABSENT_FROM_GRAPH",
    "example_hidden_derivation": "equilateral side a -> altitude h=(sqrt(3)/2)*a"
  },
  "trait_registry": {
    "preserve_lost_traits": true,
    "backcross_policy": "EXPLICIT_ANCESTOR_PLUS_TRAIT_MASK",
    "backcross_formula": "child=B(current,ancestor;trait_mask)",
    "lost_trait_state": "QUIESCENT_OR_UNEXPRESSED_NOT_DELETED"
  },
  "quiescent_bank": {
    "enabled": true,
    "metaphor": "in-vitro tube bank with reduced activity",
    "deletion_policy": "NO_SILENT_DELETE",
    "activity_range": "0<=activity<=1; quiescent ~= low activity, not zero existence",
    "reactivation": "EXPLICIT_REACTIVATE"
  },
  "noise_model": {
    "residual_definition": "Delta_PT=d(practice_observation,theory_prediction)",
    "initial_owner": "TOKEN_VAZIO_RESIDUAL_OWNER",
    "principle": "Do not decide a priori whether practice or theory is noise.",
    "allowed_reclassifications": [
      "MEASUREMENT_NOISE",
      "MODEL_MISSPECIFICATION",
      "DISCRETIZATION_ARTIFACT",
      "UNMODELED_STRUCTURE",
      "IMPLEMENTATION_GAP",
      "THEORY_ONLY_PREDICTION",
      "PRACTICE_ONLY_EFFECT",
      "CONTRADICTION",
      "ANOMALY"
    ]
  }
}
